{
  "schemaVersion": 1,
  "id": 1,
  "key": "ivy",
  "displayName": "Ivy",
  "status": "calibration",
  "retailReference": {
    "appId": 1422450,
    "buildId": 24882156,
    "material": "models/heroes_staging/tengu/tengu_v2/materials/ivy_bodyv3.vmat_c",
    "materialSha256": "74815a7acecd73483268d2b5a4ea0db459e9c8e3f86f3b7552fc753659f406c1",
    "pixelShaderSha256": "eceff13193baccd5310db90ac9b3dd36928d941753c98494e349fa9e29826930"
  },
  "directDiffuse": {
    "enabled": true,
    "stepSharpness": 0.18,
    "pbrBlend": 0.72,
    "wrap": 0.48,
    "normalization": 0.85,
    "evidence": "calibrated-approximation"
  },
  "bounceLighting": {
    "enabled": true,
    "ambientFloor": 0.18,
    "transmissiveStrength": 0.0,
    "aoStrength": 0.55,
    "evidence": "calibrated-approximation"
  },
  "directSpecular": {
    "enabled": true,
    "steps": 3.0,
    "stepSharpness": 0.55,
    "tint": 0.35,
    "roughnessBias": 0.18,
    "reflectance": 0.025,
    "evidence": "calibrated-approximation"
  },
  "rimLighting": {
    "enabled": true,
    "wrap": 1.0,
    "falloff": 2.0,
    "strength": 0.75,
    "upRamp": [
      -0.25,
      0.7
    ],
    "evidence": "calibrated-approximation"
  },
  "previewLighting": {
    "keyDirection": [
      0.494,
      0.766,
      -0.411
    ],
    "keyColor": [
      1.0,
      1.0,
      1.0
    ],
    "keyIntensity": 1.15,
    "fillDirection": [
      -0.693,
      0.071,
      0.719
    ],
    "fillColor": [
      1.0,
      1.0,
      1.0
    ],
    "fillIntensity": 0.4,
    "environmentColor": [
      0.827451,
      0.886275,
      0.972549
    ],
    "environmentDiffuse": 0.22,
    "evidence": "calibrated-approximation"
  },
  "referenceTint": [
    0.321569,
    0.388235,
    0.176471
  ],
  "outline": {
    "enabled": true,
    "color": [
      0.164706,
      0.054902,
      0.054902
    ],
    "colorEvidence": "confirmed-static-retail",
    "widthMillimeters": 1.0,
    "widthStatus": "calibrated-approximation"
  },
  "painterApply": {
    "outlineAllMeshes": true,
    "heroTextureSets": [
      "ivy_builder_arms",
      "ivy_builder_body",
      "ivy_builder_head"
    ],
    "retailPreview": {
      "sourcePolicy": "project-0source-then-retail-vpk",
      "vertexColorSource": "models/heroes_wip/ivy/ivy_ivy.dmx",
      "materialBindings": [
        {
          "textureSet": "models_heroes_staging_tengu_tengu_v2_materials_ivy_bodyv3.vmat",
          "material": "models/heroes_staging/tengu/tengu_v2/materials/ivy_bodyv3.vmat_c"
        },
        {
          "textureSet": "models_heroes_staging_tengu_tengu_v2_materials_ivy_gearv3.vmat",
          "material": "models/heroes_staging/tengu/tengu_v2/materials/ivy_gearv3.vmat_c"
        },
        {
          "textureSet": "models_heroes_staging_tengu_tengu_v2_materials_ivy_wingsv3.vmat",
          "material": "models/heroes_staging/tengu/tengu_v2/materials/ivy_wingsv3.vmat_c"
        },
        {
          "textureSet": "materials_dev_vertcolor_pbr_basic.vmat",
          "material": "materials/dev/vertcolor_pbr_basic.vmat_c"
        }
      ]
    }
  }
}
